{
  "id": "rev-the-trading-pit",
  "propFirmId": "d0000016-0000-0000-0000-000000000016",
  "summary": "With an overall score of 78/100, The Trading Pit stands out by offering both CFD and Futures challenges, a rare combination in the prop firm space. It provides funding up to $250,000, weekly payouts, and access to a wide range of platforms including MT4, MT5, cTrader, TradingView, and advanced futures platforms.\n\nHowever, there are drawbacks. Profit splits for lower-tier accounts start at 50%, which is below many competitors. Some traders report platform stability issues during high volatility, and while forex spreads are competitive, crypto commissions and futures market data upgrades add extra costs.",
  "pros": [
    "CFDs, Stocks, and Futures challenges available",
    "Weekly payouts with fast 1 business day processing",
    "Wide range of markets including 46 forex pairs",
    "Multiple platform choices including MT4, MT5, cTrader, and TradingView",
    "4.2/5 Trustpilot rating from 700+ reviews",
    "Structured challenge types for different trading styles"
  ],
  "cons": [
    "Small range of crypto markets",
    "Set minimum trading days across all challenges",
    "High commission fees ($5 per lot forex, 0.20% crypto)",
    "Profit splits start at 50% for Classic accounts",
    "40% consistency rule limits single-day profits",
    "$129 activation fee on Futures challenges"
  ],
  "bestFor": "Traders who want access to both CFD and Futures markets, structured challenges with transparent rules, and multiple platform choices including advanced futures platforms",
  "notIdealFor": "Traders looking for higher starting profit splits, low crypto trading costs, or firms without consistency rules and minimum trading day requirements",
  "overallScore": 78,
  "categoryScores": {
    "challenges": 90,
    "spreads": 70,
    "markets": 90,
    "payouts": 80,
    "platforms": 80,
    "trust": 60
  },
  "categorySections": {
    "challenges": "custom",
    "spreads": "custom",
    "markets": "custom",
    "platforms": "custom",
    "payouts": "custom",
    "support": "custom",
    "trust": "custom"
  },
  "verdictBlocks": [
    {
      "heading": "Our Final Verdict On The Trading Pit",
      "body": "The Trading Pit stands out with its CFD and Futures challenges, offering a unique alternative to many forex-focused prop firms. With funding up to $250,000, weekly payouts, and a choice between one-phase and two-phase evaluations, it provides flexibility for different trading styles. The platform selection is also strong, with access to MT4, MT5, cTrader, TradingView, and advanced futures trading platforms.\n\nHowever, there are some drawbacks. Profit splits for lower-tier accounts start at 50-60%, which is lower than some competitors. Some traders have also reported platform stability issues during high volatility. Additionally, trading costs are mixed — while forex spreads are competitive, crypto commissions and futures market data upgrades may be a concern for cost-conscious traders.\n\nOverall, The Trading Pit is a solid choice for traders who want access to both CFDs and Futures, transparent funding models, and a growing community. If you prioritize weekly payouts and structured challenges, it could be a great fit."
    }
  ],
  "faq": [
    {
      "q": "What broker does The Trading Pit use?",
      "a": "The Trading Pit is not a broker-backed prop firm, but partners with different online brokers for liquidity and execution. For cTrader CFD trading, Tickmill is used as the liquidity provider. Other platforms may have different broker arrangements, but The Trading Pit does not operate under a single brokerage. Instead, it integrates with multiple providers to facilitate trading across CFDs and Futures."
    },
    {
      "q": "Does The Trading Pit accept US clients?",
      "a": "The Trading Pit accepts clients from the United States for Futures Challenges only. CFD, Crypto, and Stock Challenges are not currently offered to US traders, but the firm has stated plans to expand these options in the future. Canadian residents face the same restrictions, with only Futures Challenges available at this time."
    },
    {
      "q": "Is The Trading Pit legit or a scam?",
      "a": "The Trading Pit is a legitimate prop firm and not a scam, but has some drawbacks, earning a 78/100 score from Best Prop Firms. While it offers CFD and Futures challenges, weekly payouts, and funding up to $250K, some traders have raised concerns about platform stability during volatility and lower-tier profit splits starting at 50%."
    },
    {
      "q": "What is The Trading Pit's profit split?",
      "a": "The Trading Pit's profit split ranges from 50% to 80%, depending on the challenge type and account tier. Prime challenges offer a fixed 80% split, while Classic challenges start at 50% and scale up to 80% as traders progress. Lower-tier accounts have smaller splits, which some traders find less competitive compared to the top prop firms."
    },
    {
      "q": "Does The Trading Pit allow EAs and copy trading?",
      "a": "The Trading Pit allows EAs (Expert Advisors) on all challenges but only permits copy trading on Futures accounts. CFD challenges do not support copy trading, while Futures traders can use it on both Prime and Classic models, with a limit of up to five linked accounts."
    }
  ],
  "verified": true,
  "flagged": false,
  "methodologyVersion": "1.0",
  "lastReviewedAt": "2026-02-24"
}
