{
  "id": "rev-ic-funded",
  "propFirmId": "d0000022-0000-0000-0000-000000000022",
  "summary": "IC Funded scored 79/100 during testing, placing it among the top-rated prop firms. You can choose between a one or two step challenge, but both come with profit splits starting at 75% and increasing to 80% after one month of trading (and after the first payout is processed).\n\nYou'll trade with IC Markets' pricing, including spreads from 0 pips, and use platforms like MT4, MT5, or cTrader. While scaling is capped at $500K and copy and weekend trading aren't allowed, the low costs, strong trading conditions, and structured challenges make it a solid choice.",
  "pros": ["Fees from $29.75", "Backed by IC Markets", "MT4, MT5, and cTrader"],
  "cons": ["Profit split 75% - 80%", "Limited scaling to 500K", "No crypto trading"],
  "bestFor": "Traders who prioritise low trading costs, tight spreads, and broker-backed execution from IC Markets",
  "notIdealFor": "Traders who need high profit splits, crypto trading, or scaling beyond $500K",
  "overallScore": 79,
  "categoryScores": { "challenges": 80, "spreads": 100, "markets": 90, "payouts": 90, "platforms": 90, "trust": 90 },
  "categorySections": {
    "challenges": "IC Funded offers both **one step** and **two step** challenges. The one step has a single 10% profit target with 6% max drawdown, while the two step splits across 10% and 5% targets with a more generous 10% max drawdown.\n\nAccount sizes range from **$5,000 to $500,000** with fees starting at just **$29.75**. Both models require a minimum of 5 trading days with no maximum time limit. Profit splits start at **75%** and increase to **80%** after the first month.\n\nScaling is performance-based up to $500K total allocation. IC Funded scored 8/10 for challenges thanks to clear structure, competitive pricing, and flexibility across both options.",
    "spreads": "IC Funded provides forex spreads the same as those offered by **IC Markets' Global Raw Account**. Minimum spreads on popular forex pairs like EUR/USD are as low as **0 pips**, with an average of **0.02 pips**.\n\nCommission is a flat **$3.50 per lot** per round turn for forex, commodities, and indices. IC Funded scored 10/10 for spreads — the combination of ultra-low spreads, transparent commissions, and competitive fees makes it one of the most competitively priced prop firms.",
    "markets": "IC Funded offers **96 trading instruments** across commodity, equity index, and forex markets. Forex pairs and Gold have up to **50:1 leverage**, indices and other commodities up to **10:1**, and equities up to **5:1**.\n\nCrypto and share trading are not available through IC Funded, though IC Markets does offer these. IC Funded scored 9/10 for markets — broad access to core instruments with consistent leverage across challenge types.",
    "platforms": "IC Funded supports **MT4**, **MT5**, and **cTrader** — three of the most popular platforms for prop trading. MT4 is strong for EA and indicator-focused traders, MT5 adds advanced order types and economic calendar, and cTrader offers Level II market depth and advanced charting.\n\nAll platforms support automated trading through Expert Advisors, though copy trading is prohibited. IC Funded scored 9/10 for platforms.",
    "payouts": "Profit splits start at **75%** and increase to **80%** after the first month of funded trading. The default payout schedule is monthly, with bi-weekly and on-demand options available (on-demand from 14 days after first trade).\n\nWithdrawals are processed via bank wire, Skrill, or crypto. Minimum net profit is **$20** for bank wire and **$150** for crypto payouts. The challenge fee is refunded with the first profit withdrawal after 30 days of trading. IC Funded scored 9/10 for payouts.",
    "support": "IC Funded provides **24/7 customer support** through AI-assisted live chat, with email support for more complex matters. No direct contact number is available.\n\nEducational resources include curated videos on market trends and trading strategies accessible through the client dashboard, covering platform navigation, market analysis, and broader financial topics.",
    "trust": "IC Funded is closely connected to **IC Markets**, a well-established broker regulated by **ASIC** in Australia and **CySEC** in Europe. While IC Funded itself is not a regulated broker, the IC Markets connection provides a solid trust foundation.\n\nTrustPilot score is **2.7/5** with mixed reviews — many lower ratings come from users still in evaluation or waiting on first payouts rather than funded traders. IC Funded uses its own dedicated chat community instead of Discord, managed directly by the team. Social media presence is relatively small compared to competitors."
  },
  "verdictBlocks": [{ "heading": "Final Verdict on IC Funded", "body": "IC Funded is a well-priced and accessible prop firm, offering both one step and two step evaluations with fees starting from $29.75 and account sizes up to $500,000. You get access to IC Markets' tight spreads, reliable execution, and a solid platform lineup including MT4, MT5, and cTrader, along with a profit split that increases from 75% to 80% after one month of funded trading and the first payout.\n\nThe challenge structure is clear and consistent, with realistic profit targets and no maximum time limits, making it a good fit if you prefer a straightforward evaluation without unnecessary complexity. That said, scaling is capped at $500K and there's no access to crypto or share trading, which may be limiting if broader market access or higher scaling is a priority.\n\nOverall, IC Funded is a strong option if you want low trading costs, proven liquidity, and a simple path to funded trading. If higher scaling limits or a wider range of markets matter more to you, other prop firms may be a better fit." }],
  "faq": [
    { "q": "What is the evaluation process for IC Funded?", "a": "IC Funded lets you choose between a one step or two step prop challenge. The one step challenge has a single 10% profit target with 6% max drawdown, while the two step includes two phases with 10% and 5% targets and 10% max drawdown. Both require a minimum of 5 trading days with no maximum time limit. Once you meet the profit targets and follow the rules, you qualify for a funded account with profit share." },
    { "q": "What is the profit split structure at IC Funded?", "a": "The profit split starts at 75% in favour of the trader and increases to 80% after the first month of trading on a funded account and after the first payout is processed." },
    { "q": "What platforms are available with IC Funded?", "a": "IC Funded supports MetaTrader 4 (MT4), MetaTrader 5 (MT5), and cTrader. Each platform provides strong trading tools and features, and trading rules allow for Expert Advisors and automated trading. Copy trading is not permitted." },
    { "q": "Is proprietary trading good for beginners?", "a": "Proprietary trading can be challenging for beginners due to the high-risk environment and stringent profit targets, and is generally recommended for experienced traders. However, it offers access to capital and potential profit splits without risking personal funds. Beginners should have a solid understanding of risk management, trading strategies, and market analysis before considering proprietary trading." }
  ],
  "methodologyVersion": "1.0",
  "lastReviewedAt": "2026-02-24"
}
