{
  "id": "rev-e8-markets",
  "propFirmId": "d0000041-0000-0000-0000-000000000041",
  "summary": "E8 Markets scores 58/100 in our evaluation.",
  "pros": [],
  "cons": [],
  "bestFor": "",
  "notIdealFor": "",
  "overallScore": 58,
  "categoryScores": {
    "challenges": 50,
    "spreads": 60,
    "markets": 70,
    "payouts": 40,
    "platforms": 70,
    "trust": 60
  },
  "verified": true,
  "methodologyVersion": "1.0",
  "lastReviewedAt": "2026-02-27"
}
