{
  "id": "rev-seacrest-funding",
  "propFirmId": "d0000038-0000-0000-0000-000000000038",
  "summary": "Seacrest Funding scores 65/100 in our evaluation.",
  "pros": [],
  "cons": [],
  "bestFor": "",
  "notIdealFor": "",
  "overallScore": 65,
  "categoryScores": {
    "challenges": 60,
    "spreads": 70,
    "markets": 60,
    "payouts": 70,
    "platforms": 70,
    "trust": 60
  },
  "verified": true,
  "methodologyVersion": "1.0",
  "lastReviewedAt": "2026-02-27"
}
