{
  "id": "rev-elite-trader-funding",
  "propFirmId": "d0000033-0000-0000-0000-000000000033",
  "summary": "Elite Trader Funding scored 47/100 in our review because while it offers wide instrument access, flexible platform support, and several unique challenge types, it falls short in key areas that matter to serious traders. The biggest issue is its vague path to live funding — you are required to pay for Sim-Funded access after passing, but there's no clear process for when or if real capital will follow.\n\nThe model is payout-friendly on the surface, but with unclear promotion rules, high ongoing costs, and strict trade rules, ETF feels more like a subscription-based payout system than a traditional prop firm. It may suit futures traders who want short-term payout opportunities, but anyone seeking predictable long-term capital should approach with caution.",
  "pros": [
    "Full access to major US futures exchanges (CME, CBOT, COMEX, NYMEX)",
    "Weekly profit payouts with 100% split on first $12,500",
    "Active Discord community with nearly 16,000 members",
    "Six evaluation models covering different trading styles",
    "Broad platform support with no vendor lock-in",
    "Free real-time exchange data during evaluation phase"
  ],
  "cons": [
    "No clear or guaranteed path to real funding after evaluation",
    "Activation fees ($80/month or $150–$300) required for Sim-Funded access",
    "Sim-Funded accounts are demo-based — not real capital",
    "High monthly exchange data fees ($128/venue) on LIVE Elite accounts",
    "24% of Trustpilot reviews are 1-star with payout disputes common",
    "No live chat or phone support available"
  ],
  "bestFor": "Experienced futures traders who want short-term payout access with flexible platform options and are comfortable with a subscription-based model that may not lead to real funded capital",
  "notIdealFor": "Traders seeking a transparent, guaranteed path to live funding, beginners who need structured guidance, or anyone uncomfortable with ongoing monthly costs and demo-based funded accounts",
  "overallScore": 47,
  "categoryScores": {
    "challenges": 30,
    "spreads": 50,
    "markets": 50,
    "payouts": 50,
    "platforms": 60,
    "support": 50,
    "trust": 40
  },
  "categorySections": {
    "challenges": "custom",
    "spreads": "custom",
    "markets": "custom",
    "platforms": "custom",
    "payouts": "custom",
    "support": "custom",
    "trust": "custom"
  },
  "verdictBlocks": [
    {
      "heading": "Our Final Verdict On Elite Trader Funding",
      "body": "Elite Trader Funding is a mixed bag. On one hand, it provides full exchange access, several evaluation models, and flexible platform options. On paper, it caters well to futures traders who want variety and weekly payout potential. But when you dig deeper, the structure feels more like a recurring subscription system than a straightforward path to real capital.\n\nThe biggest red flag is the lack of transparency around real funding. Passing an evaluation just unlocks another simulated stage with added fees and stricter rules. There's no published path to LIVE Elite access, and approvals are entirely at ETF's discretion. Some traders are upgraded, others aren't, with no clear explanation. That's a risk many won't want to take.\n\nAdd in high monthly costs once live, strict contract limits, and mixed reviews around payouts, and the appeal starts to wear thin. Yes, ETF does pay out and maintain an active community, but the model leans heavily in the firm's favour. You pay to stay in, and real capital remains optional from their side.\n\nFor experienced traders looking for short-term payout access and who are comfortable trading futures in a controlled environment, ETF might be worth a trial. But if you're looking for a predictable, structured route to long-term funding, this probably isn't it."
    }
  ],
  "faq": [
    {
      "q": "Does Elite Trader Funding pay out?",
      "a": "Yes, Elite Trader Funding does pay out, but only if you meet specific account conditions and payout buffers. After passing an evaluation, traders must activate a Sim-Funded account and follow strict rules before withdrawing. You need at least 10 active trading days and must exceed the drawdown buffer by a set amount. While many users report receiving payments, others have faced denials, so understanding payout rules is essential before signing up."
    },
    {
      "q": "What is the 10 second rule for Elite Trader Funding?",
      "a": "The 10 second rule at Elite Trader Funding prohibits entering and exiting a trade within 10 seconds. This rule is meant to discourage scalping and ultra-short-term trades that violate their platform usage policies. Breaking the rule can lead to disqualification or loss of profits. It applies during both evaluation and funded account stages and is enforced automatically by their monitoring systems."
    },
    {
      "q": "Is Elite Trader Funding regulated?",
      "a": "No, Elite Trader Funding is not a regulated financial entity or a broker-backed prop firm. It operates as a futures prop trading firm using simulated accounts and does not require regulatory oversight for its core services. While live funding is offered through a broker partnership with EdgeClear, the evaluation and Sim-Funded phases are unregulated. This means there's limited external accountability."
    },
    {
      "q": "How many accounts can you have on Elite Trader Funding?",
      "a": "Elite Trader Funding allows you to hold multiple accounts, with specific limits depending on the account type. You can run up to 20 active Sim-Funded accounts at once, including a maximum of three Fast Track accounts. However, each account must follow its own rules, and exceeding position limits across combined accounts can lead to disqualification."
    }
  ],
  "verified": true,
  "flagged": true,
  "flaggedWarning": "Elite Trader Funding does not provide a clear, guaranteed path to real funding. After passing an evaluation, traders are placed into a **Sim-Funded account** (still demo-based) that requires additional activation fees ($80/month or $150–$300 one-time). Progression to a LIVE Elite account with real capital is entirely at the firm's discretion, with no published criteria.\n\nThe firm's model relies heavily on recurring fees, and payouts come from simulated trading performance rather than real market capital in most cases. We recommend traders research the full cost structure and funding pathway before committing.",
  "methodologyVersion": "1.0",
  "lastReviewedAt": "2026-02-28"
}
